{"vehicle_id":"597c4936-2e01-4681-afb6-cf82c1dec63c","policy_id":"1e58604a-fbfe-4b6e-afbf-e0d2293a7998","rc_number":"KA01MJ9999","registration_date":"2024-03-01","owner_details":{"full_name":"Priya Sharma","kyc_document_number":"ABCDP1234E","kyc_document_type":"PAN","email":"priya@example.com","phone_number":"9876501234"},"kyc_status":"VERIFIED","registered_at":"2026-10-11T08:40:54.524328287Z"}