{"vehicle_id":"7961fa7e-a88f-44de-865a-49331e84d20c","policy_id":"3c6b9c6d-182c-4faf-b98e-4c69ab38e469","rc_number":"MH12NS2978","registration_date":"2023-10-20","owner_details":{"full_name":"Diya Patel","kyc_document_number":"XXXXXX978G","kyc_document_type":"PAN","email":"d***@example.com","phone_number":"XXXXXX5678"},"kyc_status":"VERIFIED","registered_at":"2026-10-20T14:20:10.414806251Z","vehicle_segment_id":null}