{"vehicle_id":"14ffced6-a45f-4720-843f-751d4383a768","policy_id":"950d1d34-5b20-4fa6-b3a0-0d951b7980e7","rc_number":"MH12AB9612","registration_date":"2024-05-10","owner_details":{"full_name":"Consent Test Owner","kyc_document_number":"XXXXXX612F","kyc_document_type":"PAN","email":"c***@example.com","phone_number":"XXXXXX3210"},"kyc_status":"VERIFIED","registered_at":"2026-10-17T11:30:50.909324063Z"}