{"vehicle_id":"3eb26312-4188-4b11-a697-658a41c56352","policy_id":"35a4b83c-9c14-413e-b80d-561bf9f7060c","rc_number":"MH12SM8312","registration_date":"2024-10-20","owner_details":{"full_name":"Aarav Sharma","kyc_document_number":"XXXXXX312F","kyc_document_type":"PAN","email":"a***@example.com","phone_number":"XXXXXX3210"},"kyc_status":"VERIFIED","registered_at":"2026-10-20T14:20:10.340701680Z","vehicle_segment_id":"sedan_mid"}